{
  "$schema": "../schema/composite-skill-v1.json",
  "id": "cloud-security",
  "type": "composite-skill",
  "version": "1.0.0",
  "metadata": {
    "name": "Cloud Security Assessment",
    "nameZh": "云安全评估",
    "description": "IAM, VPC, encryption and cloud security controls",
    "descriptionZh": "IAM、VPC、加密和云安全控制",
    "author": "skills4coder-team",
    "tags": [
      "cloud",
      "security",
      "iam",
      "vpc",
      "encryption"
    ],
    "category": "security"
  },
  "input": {
    "schema": {
      "type": "object",
      "properties": {},
      "required": []
    }
  },
  "output": {
    "schema": {
      "type": "object",
      "properties": {},
      "required": []
    }
  },
  "workflow": {
    "description": "IAM, VPC, encryption and cloud security controls",
    "steps": [
      {
        "id": "scan-iam",
        "name": "Scan IAM Policies",
        "nameZh": "扫描IAM策略",
        "type": "llm",
        "input": {},
        "output": "iam_findings"
      },
      {
        "id": "scan-network",
        "name": "Scan Network Security",
        "nameZh": "扫描网络安全",
        "type": "llm",
        "input": {},
        "output": "network_findings"
      },
      {
        "id": "generate-report",
        "name": "Generate Security Report",
        "nameZh": "生成安全报告",
        "atomicSkill": "write-file",
        "input": {
          "path": "cloud-security-report.md",
          "content": {}
        },
        "output": "report",
        "dependsOn": [
          "scan-iam",
          "scan-network"
        ]
      }
    ]
  }
}
