{
  "$schema": "../schema/composite-skill-v1.json",
  "id": "frontend-architecture",
  "type": "composite-skill",
  "version": "1.0.0",
  "metadata": {
    "name": "Frontend Architecture",
    "nameZh": "前端架构",
    "description": "Design frontend architecture and component systems",
    "descriptionZh": "设计前端架构和组件系统",
    "author": "skills4coder-team",
    "tags": [
      "frontend",
      "architecture",
      "components"
    ],
    "category": "frontend"
  },
  "input": {
    "schema": {
      "type": "object",
      "properties": {},
      "required": []
    }
  },
  "output": {
    "schema": {
      "type": "object",
      "properties": {},
      "required": []
    }
  },
  "workflow": {
    "description": "Design frontend architecture and component systems",
    "steps": [
      {
        "id": "analyze-requirements",
        "name": "Analyze Requirements",
        "nameZh": "需求分析",
        "type": "llm",
        "input": {},
        "output": "requirements"
      },
      {
        "id": "design-components",
        "name": "Design Components",
        "nameZh": "设计组件",
        "type": "llm",
        "input": {
          "requirements": "{{steps.analyze-requirements.output}}"
        },
        "output": "components"
      },
      {
        "id": "write-components",
        "name": "Write Components",
        "nameZh": "编写组件",
        "atomicSkill": "write-file",
        "input": {
          "path": "src/components/",
          "content": "{{steps.design-components.output}}"
        },
        "output": "files",
        "dependsOn": [
          "design-components"
        ]
      }
    ]
  }
}
